{
  "psm_collector": "macos",
  "version": "1.0",
  "host": "macbook.local",
  "taken_at": "2026-07-06T09:00:00Z",
  "modules": {
    "apps": [
      {
        "id": "com.apple.Safari",
        "name": "Safari",
        "version": "17.4",
        "path": "/Applications/Safari.app",
        "source": "system"
      }
    ],
    "persistence": [
      {
        "location": "launchagent",
        "name": "com.apple.Spotlight",
        "path": "/System/Library/LaunchAgents/com.apple.Spotlight.plist",
        "target": "/System/Library/CoreServices/Spotlight.app/Contents/MacOS/Spotlight",
        "args": [],
        "run_at_load": true,
        "enabled": true
      }
    ],
    "permissions": [
      {
        "pkg": "com.apple.Safari",
        "permission": "kTCCServiceCamera",
        "granted": true,
        "scope": "user"
      }
    ]
  },
  "gaps": []
}
